{
  "schema_version": "1.0.0",
  "id": "voodoo-doll",
  "kind": "heirloom",
  "game_tag": {
    "name": "VoodooDoll",
    "value": 632
  },
  "display": {
    "name": "Voodoo Doll",
    "description": "Whenever a building triggers, give it [MultParam] if it is [InRange] of [Hazard]",
    "name_key": "VoodooDoll.Name",
    "description_key": "VoodooDoll.Description"
  },
  "classification": {
    "categories": [
      "heirloom"
    ],
    "rarity": "uncommon"
  },
  "mechanics": {
    "categories": [
      "heirloom"
    ],
    "valid_triggers": [
      "building-activation-occurred"
    ],
    "rarity": "uncommon",
    "buy_price": 7,
    "multiplier": 0.1,
    "behavior_tag": "voodoo-doll",
    "target_tags": [],
    "target_categories": [],
    "target_tile_types": [],
    "target_rarities": [],
    "behavior_multiplier": 1,
    "activation_count": 0,
    "activation_chance": 1,
    "cooldown": -1,
    "roll_chance_multiplier": 1,
    "score_preview_mode": "none",
    "end_of_turn_execution_priority": 10,
    "mechanics_coverage": "partial"
  },
  "relationships": [
    {
      "type": "affected_by_mechanic",
      "target_mechanic_id": "trigger-execution-priority"
    }
  ],
  "assets": [
    {
      "role": "icon",
      "path": "assets/heirlooms/voodoo-doll/icon.png",
      "generated": false,
      "width": 11,
      "height": 11,
      "rect": {
        "x": 77,
        "y": 168,
        "width": 11,
        "height": 11
      },
      "pivot": {
        "x": 0.5,
        "y": 0.5
      }
    },
    {
      "role": "card_preview",
      "path": "assets/heirlooms/voodoo-doll/card-preview.png",
      "generated": true,
      "width": 128,
      "height": 128,
      "style": {
        "category": null,
        "rarity": null,
        "background_rgba": [
          166,
          188,
          202,
          255
        ],
        "label_rgba": [
          50,
          102,
          153,
          255
        ],
        "border_rgba": [
          58,
          70,
          86,
          255
        ]
      },
      "font_family": "Ignore 17"
    },
    {
      "role": "info_card",
      "path": "assets/heirlooms/voodoo-doll/info-card.png",
      "generated": true,
      "width": 472,
      "height": 436,
      "render_scale": 4,
      "runtime_values": "catalog_static_reconstruction",
      "font_family": "Ignore 17"
    }
  ],
  "notes": []
}
