{
  "schema_version": "1.0.0",
  "id": "spell-trigger",
  "kind": "consumable",
  "game_tag": {
    "name": "SpellTrigger",
    "value": 900
  },
  "display": {
    "name": "Activation Philtre",
    "description": "{Trigger} target building without ending the week [BREAK]Does not count towards a building's weekly trigger limit",
    "name_key": "Trigger.Name",
    "description_key": "Trigger.Description"
  },
  "classification": {
    "item_type": {
      "name": "Potion",
      "value": 5
    }
  },
  "mechanics": {},
  "relationships": [
    {
      "type": "affected_by_mechanic",
      "target_mechanic_id": "consumable-roll-multipliers"
    }
  ],
  "assets": [
    {
      "role": "icon",
      "path": "assets/consumables/spell-trigger/icon.png",
      "generated": false,
      "width": 11,
      "height": 11,
      "rect": {
        "x": 33,
        "y": 58,
        "width": 11,
        "height": 11
      },
      "pivot": {
        "x": 0.5,
        "y": 0.5
      }
    },
    {
      "role": "card_preview",
      "path": "assets/consumables/spell-trigger/card-preview.png",
      "generated": true,
      "width": 120,
      "height": 136,
      "style": {
        "item_type": "potion",
        "frame_source": "ShopItemSpell/ShopBGSpell"
      },
      "font_family": "Ignore 17"
    },
    {
      "role": "info_card",
      "path": "assets/consumables/spell-trigger/info-card.png",
      "generated": true,
      "width": 472,
      "height": 540,
      "render_scale": 4,
      "runtime_values": "catalog_static_reconstruction",
      "font_family": "Ignore 17"
    }
  ],
  "notes": []
}
