{
  "schema_version": "1.0.0",
  "id": "cotton-field-empty",
  "kind": "building",
  "game_tag": {
    "name": "CottonFieldEmpty",
    "value": 255
  },
  "display": {
    "name": "Cotton Field",
    "description": "Grows (transforms) in [Cooldown] weeks and then {triggers:} @Give each [Adjacent] building [MultParam]",
    "name_key": "CottonField.Name",
    "description_key": "CottonField.Description"
  },
  "classification": {
    "categories": [
      "commercial",
      "crop",
      "farm"
    ],
    "rarity": "common",
    "draft_group": "default"
  },
  "mechanics": {
    "categories": [
      "commercial",
      "crop",
      "farm"
    ],
    "valid_triggers": [
      "on-end-of-turn",
      "on-activate"
    ],
    "rarity": "common",
    "cooldown": 3,
    "multiplier": 0.2,
    "behavior_tag": "cotton-field-empty",
    "target_tags": [],
    "target_categories": [],
    "target_tile_types": [],
    "target_rarities": [],
    "behavior_multiplier": 1,
    "activation_count": 0,
    "activation_chance": 1,
    "buy_price": 77,
    "roll_chance_multiplier": 1,
    "score_preview_mode": "none",
    "placement_count": 1,
    "range_placement_restriction": true,
    "can_be_placed_on": [],
    "can_be_activated": true,
    "times_can_trigger_per_week": 10,
    "irrigated_cooldown": 1,
    "end_of_turn_execution_priority": 2,
    "mechanics_coverage": "partial"
  },
  "relationships": [
    {
      "type": "transforms_into",
      "target_id": "cotton-field"
    },
    {
      "type": "affected_by_category",
      "target_category": "irrigator"
    },
    {
      "type": "affected_by_mechanic",
      "target_mechanic_id": "crop-growth"
    },
    {
      "type": "affected_by_mechanic",
      "target_mechanic_id": "building-draft-rarity-weights"
    },
    {
      "type": "affected_by_mechanic",
      "target_mechanic_id": "rarity-milestone-multipliers"
    },
    {
      "type": "affected_by_mechanic",
      "target_mechanic_id": "building-draft-roll-weight"
    },
    {
      "type": "affected_by_mechanic",
      "target_mechanic_id": "trigger-execution-priority"
    }
  ],
  "assets": [
    {
      "role": "ground",
      "path": "assets/buildings/cotton-field-empty/ground.png",
      "generated": false,
      "width": 13,
      "height": 26,
      "rect": {
        "x": 312,
        "y": 202,
        "width": 13,
        "height": 26
      },
      "pivot": {
        "x": 0.5,
        "y": 0.25
      }
    },
    {
      "role": "icon",
      "path": "assets/buildings/cotton-field-empty/icon.png",
      "generated": true,
      "width": 11,
      "height": 11,
      "runtime_rect": {
        "x": 313,
        "y": 203,
        "width": 11,
        "height": 11
      },
      "icon_offset": {
        "x": 0,
        "y": 0
      },
      "corrupted": false,
      "rect": {
        "x": 312,
        "y": 202,
        "width": 13,
        "height": 26
      },
      "pivot": {
        "x": 0.5,
        "y": 0.25
      }
    },
    {
      "role": "painted_ground",
      "path": "assets/buildings/cotton-field-empty/ground-paint-red.png",
      "generated": true,
      "width": 13,
      "height": 26,
      "paint": "red",
      "paint_effect": "inner_outline",
      "paint_color": [
        231,
        8,
        0,
        255
      ],
      "rect": {
        "x": 312,
        "y": 202,
        "width": 13,
        "height": 26
      },
      "pivot": {
        "x": 0.5,
        "y": 0.25
      }
    },
    {
      "role": "painted_ground",
      "path": "assets/buildings/cotton-field-empty/ground-paint-gold.png",
      "generated": true,
      "width": 13,
      "height": 26,
      "paint": "gold",
      "paint_effect": "inner_outline",
      "paint_color": [
        212,
        151,
        0,
        255
      ],
      "rect": {
        "x": 312,
        "y": 202,
        "width": 13,
        "height": 26
      },
      "pivot": {
        "x": 0.5,
        "y": 0.25
      }
    },
    {
      "role": "painted_ground",
      "path": "assets/buildings/cotton-field-empty/ground-paint-green.png",
      "generated": true,
      "width": 13,
      "height": 26,
      "paint": "green",
      "paint_effect": "inner_outline",
      "paint_color": [
        0,
        164,
        7,
        255
      ],
      "rect": {
        "x": 312,
        "y": 202,
        "width": 13,
        "height": 26
      },
      "pivot": {
        "x": 0.5,
        "y": 0.25
      }
    },
    {
      "role": "painted_ground",
      "path": "assets/buildings/cotton-field-empty/ground-paint-blue.png",
      "generated": true,
      "width": 13,
      "height": 26,
      "paint": "blue",
      "paint_effect": "inner_outline",
      "paint_color": [
        0,
        180,
        255,
        255
      ],
      "rect": {
        "x": 312,
        "y": 202,
        "width": 13,
        "height": 26
      },
      "pivot": {
        "x": 0.5,
        "y": 0.25
      }
    },
    {
      "role": "painted_ground",
      "path": "assets/buildings/cotton-field-empty/ground-paint-white.png",
      "generated": true,
      "width": 13,
      "height": 26,
      "paint": "white",
      "paint_effect": "inner_outline",
      "paint_color": [
        229,
        229,
        229,
        255
      ],
      "rect": {
        "x": 312,
        "y": 202,
        "width": 13,
        "height": 26
      },
      "pivot": {
        "x": 0.5,
        "y": 0.25
      }
    },
    {
      "role": "painted_ground",
      "path": "assets/buildings/cotton-field-empty/ground-paint-purple.png",
      "generated": true,
      "width": 13,
      "height": 26,
      "paint": "purple",
      "paint_effect": "inner_outline",
      "paint_color": [
        202,
        0,
        189,
        255
      ],
      "rect": {
        "x": 312,
        "y": 202,
        "width": 13,
        "height": 26
      },
      "pivot": {
        "x": 0.5,
        "y": 0.25
      }
    },
    {
      "role": "painted_ground",
      "path": "assets/buildings/cotton-field-empty/ground-paint-dark.png",
      "generated": true,
      "width": 13,
      "height": 26,
      "paint": "dark",
      "paint_effect": "greyscale",
      "paint_color": [
        46,
        46,
        46,
        255
      ],
      "rect": {
        "x": 312,
        "y": 202,
        "width": 13,
        "height": 26
      },
      "pivot": {
        "x": 0.5,
        "y": 0.25
      }
    },
    {
      "role": "card_preview",
      "path": "assets/buildings/cotton-field-empty/card-preview.png",
      "generated": true,
      "width": 128,
      "height": 128,
      "style": {
        "category": "commercial",
        "rarity": null,
        "background_rgba": [
          207,
          186,
          138,
          255
        ],
        "label_rgba": [
          204,
          147,
          18,
          255
        ],
        "border_rgba": [
          174,
          106,
          34,
          255
        ],
        "frame_source": "BuildingButton.prefab/Panel3/rarity border"
      },
      "font_family": "Ignore 17"
    },
    {
      "role": "info_card",
      "path": "assets/buildings/cotton-field-empty/info-card.png",
      "generated": true,
      "width": 472,
      "height": 516,
      "render_scale": 4,
      "runtime_values": "catalog_static_reconstruction",
      "font_family": "Ignore 17"
    }
  ],
  "notes": []
}
