{
  "schema_version": "1.0.0",
  "id": "spell-place-anywhere",
  "kind": "consumable",
  "game_tag": {
    "name": "SpellPlaceAnywhere",
    "value": 915
  },
  "display": {
    "name": "Dimensional Dose",
    "description": "The next building you place can be placed {ANYWHERE} @If placed over another building, will not trigger removal effects",
    "name_key": "CanPlaceNextBuildingAnywhere.Name",
    "description_key": "CanPlaceNextBuildingAnywhere.Description"
  },
  "classification": {
    "item_type": {
      "name": "Potion",
      "value": 5
    }
  },
  "mechanics": {},
  "relationships": [
    {
      "type": "affected_by_mechanic",
      "target_mechanic_id": "consumable-roll-multipliers"
    }
  ],
  "assets": [
    {
      "role": "icon",
      "path": "assets/consumables/spell-place-anywhere/icon.png",
      "generated": false,
      "width": 11,
      "height": 11,
      "rect": {
        "x": 132,
        "y": 58,
        "width": 11,
        "height": 11
      },
      "pivot": {
        "x": 0.5,
        "y": 0.5
      }
    },
    {
      "role": "card_preview",
      "path": "assets/consumables/spell-place-anywhere/card-preview.png",
      "generated": true,
      "width": 120,
      "height": 136,
      "style": {
        "item_type": "potion",
        "frame_source": "ShopItemSpell/ShopBGSpell"
      },
      "font_family": "Ignore 17"
    },
    {
      "role": "info_card",
      "path": "assets/consumables/spell-place-anywhere/info-card.png",
      "generated": true,
      "width": 472,
      "height": 532,
      "render_scale": 4,
      "runtime_values": "catalog_static_reconstruction",
      "font_family": "Ignore 17"
    }
  ],
  "notes": []
}
