{
  "schema_version": "1.0.0",
  "id": "favour-inventor",
  "kind": "consumable",
  "game_tag": {
    "name": "FavourInventor",
    "value": 815
  },
  "display": {
    "name": "Inventor Vote",
    "description": "Add a [CouncilVote] for the [Inventor]",
    "name_key": "FavourInventor.Name",
    "description_key": "FavourInventor.Description"
  },
  "classification": {
    "item_type": {
      "name": "CouncilVote",
      "value": 4
    }
  },
  "mechanics": {},
  "relationships": [
    {
      "type": "affected_by_mechanic",
      "target_mechanic_id": "consumable-roll-multipliers"
    }
  ],
  "assets": [
    {
      "role": "icon",
      "path": "assets/consumables/favour-inventor/icon.png",
      "generated": false,
      "width": 32,
      "height": 22,
      "rect": {
        "x": 0,
        "y": 5,
        "width": 32,
        "height": 22
      },
      "pivot": {
        "x": 0.5,
        "y": 0.4988727
      }
    },
    {
      "role": "card_preview",
      "path": "assets/consumables/favour-inventor/card-preview.png",
      "generated": true,
      "width": 128,
      "height": 128,
      "style": {
        "category": null,
        "rarity": null,
        "background_rgba": [
          166,
          188,
          202,
          255
        ],
        "label_rgba": [
          50,
          102,
          153,
          255
        ],
        "border_rgba": [
          58,
          70,
          86,
          255
        ]
      },
      "font_family": "Ignore 17"
    },
    {
      "role": "info_card",
      "path": "assets/consumables/favour-inventor/info-card.png",
      "generated": true,
      "width": 472,
      "height": 500,
      "render_scale": 4,
      "runtime_values": "catalog_static_reconstruction",
      "font_family": "Ignore 17"
    }
  ],
  "notes": []
}
