{
  "schema_version": "1.0.0",
  "id": "ore",
  "kind": "building",
  "game_tag": {
    "name": "Ore",
    "value": 8
  },
  "display": {
    "name": "Ore",
    "description": null,
    "name_key": "Ore.Name",
    "description_key": null
  },
  "classification": {
    "categories": [
      "none",
      "resource",
      "engineering"
    ],
    "rarity": "none",
    "draft_group": "default"
  },
  "mechanics": {
    "categories": [
      "none",
      "resource",
      "engineering"
    ],
    "can_be_placed_on": [
      "grass",
      "sand"
    ],
    "can_be_activated": false,
    "behavior_tag": "ore",
    "target_tags": [],
    "target_categories": [],
    "target_tile_types": [],
    "target_rarities": [],
    "valid_triggers": [],
    "behavior_multiplier": 1,
    "activation_count": 0,
    "activation_chance": 1,
    "buy_price": 77,
    "cooldown": -1,
    "roll_chance_multiplier": 1,
    "score_preview_mode": "none",
    "placement_count": 1,
    "range_placement_restriction": true,
    "times_can_trigger_per_week": 10,
    "end_of_turn_execution_priority": 10,
    "mechanics_coverage": "partial"
  },
  "relationships": [
    {
      "type": "affected_by_mechanic",
      "target_mechanic_id": "trigger-execution-priority"
    }
  ],
  "assets": [
    {
      "role": "ground",
      "path": "assets/buildings/ore/ground.png",
      "generated": false,
      "width": 13,
      "height": 26,
      "rect": {
        "x": 13,
        "y": 176,
        "width": 13,
        "height": 26
      },
      "pivot": {
        "x": 0.5,
        "y": 0.25
      }
    },
    {
      "role": "icon",
      "path": "assets/buildings/ore/icon.png",
      "generated": true,
      "width": 11,
      "height": 11,
      "runtime_rect": {
        "x": 14,
        "y": 177,
        "width": 11,
        "height": 11
      },
      "icon_offset": {
        "x": 0,
        "y": 0
      },
      "corrupted": false,
      "rect": {
        "x": 13,
        "y": 176,
        "width": 13,
        "height": 26
      },
      "pivot": {
        "x": 0.5,
        "y": 0.25
      }
    },
    {
      "role": "context_render",
      "path": "assets/buildings/ore/context-grass.png",
      "generated": true,
      "width": 52,
      "height": 104,
      "terrain": "grass",
      "terrain_variant_index": 7,
      "terrain_context": "homogeneous",
      "map_coordinate": [
        0,
        0
      ],
      "nature_offset_px": [
        0,
        0
      ],
      "theme": "normal",
      "global_light": "neutral_white",
      "scale": 4,
      "pixels_per_unit": 12,
      "rect": {
        "x": 13,
        "y": 176,
        "width": 13,
        "height": 26
      },
      "pivot": {
        "x": 0.5,
        "y": 0.25
      },
      "terrain_rect": {
        "x": 132,
        "y": 246,
        "width": 12,
        "height": 12
      },
      "terrain_pivot": {
        "x": 0.5,
        "y": 0.5
      }
    },
    {
      "role": "context_render",
      "path": "assets/buildings/ore/context-sand.png",
      "generated": true,
      "width": 52,
      "height": 104,
      "terrain": "sand",
      "terrain_variant_index": 5,
      "terrain_context": "homogeneous",
      "map_coordinate": [
        0,
        0
      ],
      "nature_offset_px": [
        0,
        0
      ],
      "theme": "normal",
      "global_light": "neutral_white",
      "scale": 4,
      "pixels_per_unit": 12,
      "rect": {
        "x": 13,
        "y": 176,
        "width": 13,
        "height": 26
      },
      "pivot": {
        "x": 0.5,
        "y": 0.25
      },
      "terrain_rect": {
        "x": 84,
        "y": 222,
        "width": 12,
        "height": 12
      },
      "terrain_pivot": {
        "x": 0.5,
        "y": 0.5
      }
    },
    {
      "role": "painted_ground",
      "path": "assets/buildings/ore/ground-paint-dark.png",
      "generated": true,
      "width": 13,
      "height": 26,
      "paint": "dark",
      "paint_effect": "greyscale",
      "paint_color": [
        46,
        46,
        46,
        255
      ],
      "rect": {
        "x": 13,
        "y": 176,
        "width": 13,
        "height": 26
      },
      "pivot": {
        "x": 0.5,
        "y": 0.25
      }
    },
    {
      "role": "card_preview",
      "path": "assets/buildings/ore/card-preview.png",
      "generated": true,
      "width": 128,
      "height": 128,
      "style": {
        "category": null,
        "rarity": null,
        "background_rgba": [
          166,
          188,
          202,
          255
        ],
        "label_rgba": [
          50,
          102,
          153,
          255
        ],
        "border_rgba": [
          58,
          70,
          86,
          255
        ],
        "frame_source": "BuildingButton.prefab/Panel3/rarity border"
      },
      "font_family": "Ignore 17"
    },
    {
      "role": "info_card",
      "path": "assets/buildings/ore/info-card.png",
      "generated": true,
      "width": 472,
      "height": 484,
      "render_scale": 4,
      "runtime_values": "catalog_static_reconstruction",
      "font_family": "Ignore 17"
    }
  ],
  "notes": [
    "Localized description is unavailable."
  ]
}
