{
  "schema_version": "1.0.0",
  "id": "charcoal",
  "kind": "heirloom",
  "game_tag": {
    "name": "Charcoal",
    "value": 582
  },
  "display": {
    "name": "Charcoal",
    "description": "[Campfire] burn for [ActivationCount] times as long",
    "name_key": "Charcoal.Name",
    "description_key": "Charcoal.Description"
  },
  "classification": {
    "categories": [
      "heirloom"
    ],
    "rarity": "common"
  },
  "mechanics": {
    "categories": [
      "heirloom"
    ],
    "valid_triggers": [
      "on-unequip",
      "on-equip"
    ],
    "rarity": "common",
    "activation_count": 3,
    "buy_price": 5,
    "behavior_tag": "charcoal",
    "target_tags": [],
    "target_categories": [],
    "target_tile_types": [],
    "target_rarities": [],
    "behavior_multiplier": 1,
    "activation_chance": 1,
    "cooldown": -1,
    "roll_chance_multiplier": 1,
    "score_preview_mode": "none",
    "end_of_turn_execution_priority": 10,
    "mechanics_coverage": "partial"
  },
  "relationships": [
    {
      "type": "affected_by_mechanic",
      "target_mechanic_id": "trigger-execution-priority"
    }
  ],
  "assets": [
    {
      "role": "icon",
      "path": "assets/heirlooms/charcoal/icon.png",
      "generated": false,
      "width": 11,
      "height": 11,
      "rect": {
        "x": 154,
        "y": 157,
        "width": 11,
        "height": 11
      },
      "pivot": {
        "x": 0.5,
        "y": 0.5
      }
    },
    {
      "role": "card_preview",
      "path": "assets/heirlooms/charcoal/card-preview.png",
      "generated": true,
      "width": 128,
      "height": 128,
      "style": {
        "category": "frontier",
        "rarity": null,
        "background_rgba": [
          206,
          169,
          139,
          255
        ],
        "label_rgba": [
          166,
          81,
          10,
          255
        ],
        "border_rgba": [
          120,
          59,
          20,
          255
        ]
      },
      "font_family": "Ignore 17"
    },
    {
      "role": "info_card",
      "path": "assets/heirlooms/charcoal/info-card.png",
      "generated": true,
      "width": 472,
      "height": 436,
      "render_scale": 4,
      "runtime_values": "catalog_static_reconstruction",
      "font_family": "Ignore 17"
    }
  ],
  "notes": []
}
