{
  "schema_version": "1.0.0",
  "id": "wheat-field",
  "kind": "building",
  "game_tag": {
    "name": "WheatField",
    "value": 105
  },
  "display": {
    "name": "Wheat Field",
    "description": "{Grows} (transforms) in [Cooldown] weeks and then {triggers:} [RerollCount] and [RemoveCount]",
    "name_key": "WheatField.Name",
    "description_key": "WheatField.Description"
  },
  "classification": {
    "categories": [
      "agricultural",
      "crop",
      "farm"
    ],
    "rarity": "common",
    "draft_group": "default"
  },
  "mechanics": {
    "categories": [
      "agricultural",
      "crop",
      "farm"
    ],
    "can_be_placed_on": [
      "grass"
    ],
    "valid_triggers": [
      "on-activate",
      "on-transformed-into"
    ],
    "rarity": "common",
    "cooldown": 3,
    "rerolls": 1,
    "removes": 1,
    "behavior_tag": "wheat-field",
    "target_tags": [],
    "target_categories": [],
    "target_tile_types": [],
    "target_rarities": [],
    "behavior_multiplier": 1,
    "activation_count": 0,
    "activation_chance": 1,
    "buy_price": 77,
    "roll_chance_multiplier": 1,
    "score_preview_mode": "none",
    "placement_count": 1,
    "range_placement_restriction": true,
    "can_be_activated": true,
    "times_can_trigger_per_week": 10,
    "irrigated_cooldown": 1,
    "end_of_turn_execution_priority": 10,
    "mechanics_coverage": "partial"
  },
  "relationships": [
    {
      "type": "affected_by_category",
      "target_category": "irrigator"
    },
    {
      "type": "affected_by_mechanic",
      "target_mechanic_id": "crop-growth"
    },
    {
      "type": "affected_by_mechanic",
      "target_mechanic_id": "building-draft-rarity-weights"
    },
    {
      "type": "affected_by_mechanic",
      "target_mechanic_id": "rarity-milestone-multipliers"
    },
    {
      "type": "affected_by_mechanic",
      "target_mechanic_id": "building-draft-roll-weight"
    },
    {
      "type": "affected_by_mechanic",
      "target_mechanic_id": "trigger-execution-priority"
    },
    {
      "type": "alternate_placed_type",
      "target_id": "wheat-field-empty"
    }
  ],
  "assets": [
    {
      "role": "ground",
      "path": "assets/buildings/wheat-field/ground.png",
      "generated": false,
      "width": 13,
      "height": 26,
      "rect": {
        "x": 26,
        "y": 358,
        "width": 13,
        "height": 26
      },
      "pivot": {
        "x": 0.5,
        "y": 0.25
      }
    },
    {
      "role": "icon",
      "path": "assets/buildings/wheat-field/icon.png",
      "generated": true,
      "width": 11,
      "height": 11,
      "runtime_rect": {
        "x": 27,
        "y": 359,
        "width": 11,
        "height": 11
      },
      "icon_offset": {
        "x": 0,
        "y": 0
      },
      "corrupted": false,
      "rect": {
        "x": 26,
        "y": 358,
        "width": 13,
        "height": 26
      },
      "pivot": {
        "x": 0.5,
        "y": 0.25
      }
    },
    {
      "role": "context_render",
      "path": "assets/buildings/wheat-field/context-grass.png",
      "generated": true,
      "width": 52,
      "height": 104,
      "terrain": "grass",
      "terrain_variant_index": 7,
      "terrain_context": "homogeneous",
      "map_coordinate": [
        0,
        0
      ],
      "nature_offset_px": [
        0,
        0
      ],
      "theme": "normal",
      "global_light": "neutral_white",
      "scale": 4,
      "pixels_per_unit": 12,
      "rect": {
        "x": 26,
        "y": 358,
        "width": 13,
        "height": 26
      },
      "pivot": {
        "x": 0.5,
        "y": 0.25
      },
      "terrain_rect": {
        "x": 132,
        "y": 246,
        "width": 12,
        "height": 12
      },
      "terrain_pivot": {
        "x": 0.5,
        "y": 0.5
      }
    },
    {
      "role": "painted_ground",
      "path": "assets/buildings/wheat-field/ground-paint-red.png",
      "generated": true,
      "width": 13,
      "height": 26,
      "paint": "red",
      "paint_effect": "inner_outline",
      "paint_color": [
        231,
        8,
        0,
        255
      ],
      "rect": {
        "x": 26,
        "y": 358,
        "width": 13,
        "height": 26
      },
      "pivot": {
        "x": 0.5,
        "y": 0.25
      }
    },
    {
      "role": "painted_ground",
      "path": "assets/buildings/wheat-field/ground-paint-gold.png",
      "generated": true,
      "width": 13,
      "height": 26,
      "paint": "gold",
      "paint_effect": "inner_outline",
      "paint_color": [
        212,
        151,
        0,
        255
      ],
      "rect": {
        "x": 26,
        "y": 358,
        "width": 13,
        "height": 26
      },
      "pivot": {
        "x": 0.5,
        "y": 0.25
      }
    },
    {
      "role": "painted_ground",
      "path": "assets/buildings/wheat-field/ground-paint-green.png",
      "generated": true,
      "width": 13,
      "height": 26,
      "paint": "green",
      "paint_effect": "inner_outline",
      "paint_color": [
        0,
        164,
        7,
        255
      ],
      "rect": {
        "x": 26,
        "y": 358,
        "width": 13,
        "height": 26
      },
      "pivot": {
        "x": 0.5,
        "y": 0.25
      }
    },
    {
      "role": "painted_ground",
      "path": "assets/buildings/wheat-field/ground-paint-blue.png",
      "generated": true,
      "width": 13,
      "height": 26,
      "paint": "blue",
      "paint_effect": "inner_outline",
      "paint_color": [
        0,
        180,
        255,
        255
      ],
      "rect": {
        "x": 26,
        "y": 358,
        "width": 13,
        "height": 26
      },
      "pivot": {
        "x": 0.5,
        "y": 0.25
      }
    },
    {
      "role": "painted_ground",
      "path": "assets/buildings/wheat-field/ground-paint-white.png",
      "generated": true,
      "width": 13,
      "height": 26,
      "paint": "white",
      "paint_effect": "inner_outline",
      "paint_color": [
        229,
        229,
        229,
        255
      ],
      "rect": {
        "x": 26,
        "y": 358,
        "width": 13,
        "height": 26
      },
      "pivot": {
        "x": 0.5,
        "y": 0.25
      }
    },
    {
      "role": "painted_ground",
      "path": "assets/buildings/wheat-field/ground-paint-purple.png",
      "generated": true,
      "width": 13,
      "height": 26,
      "paint": "purple",
      "paint_effect": "inner_outline",
      "paint_color": [
        202,
        0,
        189,
        255
      ],
      "rect": {
        "x": 26,
        "y": 358,
        "width": 13,
        "height": 26
      },
      "pivot": {
        "x": 0.5,
        "y": 0.25
      }
    },
    {
      "role": "painted_ground",
      "path": "assets/buildings/wheat-field/ground-paint-dark.png",
      "generated": true,
      "width": 13,
      "height": 26,
      "paint": "dark",
      "paint_effect": "greyscale",
      "paint_color": [
        46,
        46,
        46,
        255
      ],
      "rect": {
        "x": 26,
        "y": 358,
        "width": 13,
        "height": 26
      },
      "pivot": {
        "x": 0.5,
        "y": 0.25
      }
    },
    {
      "role": "card_preview",
      "path": "assets/buildings/wheat-field/card-preview.png",
      "generated": true,
      "width": 128,
      "height": 128,
      "style": {
        "category": "agricultural",
        "rarity": null,
        "background_rgba": [
          125,
          161,
          132,
          255
        ],
        "label_rgba": [
          0,
          97,
          17,
          255
        ],
        "border_rgba": [
          37,
          86,
          46,
          255
        ],
        "frame_source": "BuildingButton.prefab/Panel3/rarity border"
      },
      "font_family": "Ignore 17"
    },
    {
      "role": "info_card",
      "path": "assets/buildings/wheat-field/info-card.png",
      "generated": true,
      "width": 472,
      "height": 484,
      "render_scale": 4,
      "runtime_values": "catalog_static_reconstruction",
      "font_family": "Ignore 17"
    }
  ],
  "notes": []
}
