{
  "schema_version": "1.0.0",
  "id": "printer",
  "kind": "heirloom",
  "game_tag": {
    "name": "Printer",
    "value": 563
  },
  "display": {
    "name": "Printing Press",
    "description": "Every [Cooldown] weeks, gain a copy of a random held [Consumable] (must have space)",
    "name_key": "Printer.Name",
    "description_key": "Printer.Description"
  },
  "classification": {
    "categories": [
      "heirloom"
    ],
    "rarity": "rare"
  },
  "mechanics": {
    "categories": [
      "heirloom"
    ],
    "valid_triggers": [
      "on-end-of-turn"
    ],
    "rarity": "rare",
    "cooldown": 3,
    "buy_price": 8,
    "behavior_tag": "printer",
    "target_tags": [],
    "target_categories": [],
    "target_tile_types": [],
    "target_rarities": [],
    "behavior_multiplier": 1,
    "activation_count": 0,
    "activation_chance": 1,
    "roll_chance_multiplier": 1,
    "score_preview_mode": "none",
    "end_of_turn_execution_priority": 10,
    "mechanics_coverage": "partial"
  },
  "relationships": [
    {
      "type": "affected_by_mechanic",
      "target_mechanic_id": "trigger-execution-priority"
    }
  ],
  "assets": [
    {
      "role": "icon",
      "path": "assets/heirlooms/printer/icon.png",
      "generated": false,
      "width": 11,
      "height": 11,
      "rect": {
        "x": 121,
        "y": 179,
        "width": 11,
        "height": 11
      },
      "pivot": {
        "x": 0.5,
        "y": 0.5
      }
    },
    {
      "role": "card_preview",
      "path": "assets/heirlooms/printer/card-preview.png",
      "generated": true,
      "width": 128,
      "height": 128,
      "style": {
        "category": null,
        "rarity": null,
        "background_rgba": [
          166,
          188,
          202,
          255
        ],
        "label_rgba": [
          50,
          102,
          153,
          255
        ],
        "border_rgba": [
          58,
          70,
          86,
          255
        ]
      },
      "font_family": "Ignore 17"
    },
    {
      "role": "info_card",
      "path": "assets/heirlooms/printer/info-card.png",
      "generated": true,
      "width": 472,
      "height": 436,
      "render_scale": 4,
      "runtime_values": "catalog_static_reconstruction",
      "font_family": "Ignore 17"
    }
  ],
  "notes": []
}
