{
  "schema_version": "1.0.0",
  "id": "gem-amethyst",
  "kind": "heirloom",
  "game_tag": {
    "name": "GemAmethyst",
    "value": 519
  },
  "display": {
    "name": "Amethyst",
    "description": "[BaseScore] whenever a building is triggered",
    "name_key": "GemAmethyst.Name",
    "description_key": "GemAmethyst.Description"
  },
  "classification": {
    "categories": [
      "heirloom",
      "gem"
    ],
    "rarity": "common"
  },
  "mechanics": {
    "categories": [
      "heirloom",
      "gem"
    ],
    "valid_triggers": [
      "building-activation-occurred"
    ],
    "rarity": "common",
    "buy_price": 5,
    "score": 10,
    "behavior_tag": "gem-amethyst",
    "target_tags": [],
    "target_categories": [],
    "target_tile_types": [],
    "target_rarities": [],
    "behavior_multiplier": 1,
    "activation_count": 0,
    "activation_chance": 1,
    "cooldown": -1,
    "roll_chance_multiplier": 1,
    "score_preview_mode": "none",
    "trigger": "building-activation-occurred",
    "end_of_turn_execution_priority": 10,
    "mechanics_coverage": "exact"
  },
  "relationships": [
    {
      "type": "affected_by_mechanic",
      "target_mechanic_id": "trigger-execution-priority"
    }
  ],
  "assets": [
    {
      "role": "icon",
      "path": "assets/heirlooms/gem-amethyst/icon.png",
      "generated": false,
      "width": 11,
      "height": 11,
      "rect": {
        "x": 44,
        "y": 201,
        "width": 11,
        "height": 11
      },
      "pivot": {
        "x": 0.5,
        "y": 0.5
      }
    },
    {
      "role": "card_preview",
      "path": "assets/heirlooms/gem-amethyst/card-preview.png",
      "generated": true,
      "width": 128,
      "height": 128,
      "style": {
        "category": null,
        "rarity": null,
        "background_rgba": [
          166,
          188,
          202,
          255
        ],
        "label_rgba": [
          50,
          102,
          153,
          255
        ],
        "border_rgba": [
          58,
          70,
          86,
          255
        ]
      },
      "font_family": "Ignore 17"
    },
    {
      "role": "info_card",
      "path": "assets/heirlooms/gem-amethyst/info-card.png",
      "generated": true,
      "width": 472,
      "height": 484,
      "render_scale": 4,
      "runtime_values": "catalog_static_reconstruction",
      "font_family": "Ignore 17"
    }
  ],
  "notes": []
}
